{
  "case_sha256": "7949ed2dd2b57168f62140d456f64db0ca1153710e7ef9197aacaf7ed6bcef48",
  "document_refs": [
    "synthetic:c13:L4-decision",
    "synthetic:c13:L4-appeal"
  ],
  "elements_sha256": "72970b164ac1a6dacda150fd0b7593e2eb0ae1eb6a95fccde8fc0b50a5c3e358",
  "evidence_set_version": "0.1.0",
  "scope": "synthetic_fixture_only"
}
