{
  "case_sha256": "cfe48ae8232630d894417dec2cee14c6e7883d4bac8c75abe81becf017bc2fbd",
  "document_refs": [
    "synthetic:c13:L3-checklist",
    "synthetic:c13:L3-alternatives"
  ],
  "elements_sha256": "c006c8d7000f622a15377bc44d7d45583d6184d3926d1e86e4a0fe9c491faa58",
  "evidence_set_version": "0.1.0",
  "scope": "synthetic_fixture_only"
}
