{
  "case_sha256": "80b2b0737e539e031c9c1c26d0a3b17fce27633cf315b664ec14ea842d347559",
  "document_refs": [
    "synthetic:c13:L1-request",
    "synthetic:c13:L1-reply"
  ],
  "elements_sha256": "47ccb4cf3cabdd6a9d756bbba4355072506f507dbff0c5d8982c1dd25ce42fe3",
  "evidence_set_version": "0.1.0",
  "scope": "synthetic_fixture_only"
}
