{
  "case_sha256": "9dff1a74d19f55243d0ecadf1137cad206c4dcaadb6def900f03ee65fae197dd",
  "document_refs": [
    "synthetic:c13:L7-complaint",
    "synthetic:c13:L7-jo-note"
  ],
  "elements_sha256": "4b58f314c3f17dd40e8791742a18678f782723c6240c89f62f152f416bdfd1f7",
  "evidence_set_version": "0.1.0",
  "scope": "synthetic_fixture_only"
}
